"Bug ID","Product","Component","Assignee","Status","Resolution","Summary","Changed"
1444774,"Fedora","coreutils","Kamil Dudka","CLOSED","ERRATA","heap overflow security issue in date(1) and touch(1)","2017-05-01 14:17:10"
1363695,"Fedora","mupdf","Pavel Zhukov","CLOSED","ERRATA","CVE-2016-6525 CVE-2016-8674 CVE-2017-5896 mupdf: various flaws [fedora-all]","2017-03-23 13:21:02"
1425338,"Fedora","mupdf","Pavel Zhukov","CLOSED","ERRATA","CVE-2017-6060 mupdf: Stack-based buffer overflow in jstest_main.c [fedora-all]","2017-04-01 13:30:35"
1443384,"Fedora","curl","Kamil Dudka","CLOSED","ERRATA","CVE-2017-7468 curl: TLS session resumption client cert bypass [fedora-all]","2017-04-21 10:28:58"
1421627,"Fedora","qemu","Fedora Virtualization Maintainers","CLOSED","CURRENTRELEASE","CVE-2017-5973 Qemu: usb: infinite loop while doing control transfer in xhci_kick_epctx [fedora-all]","2017-04-13 19:57:38"